{
  "detail-type": "FileStateChange",
  "source": "orcabus.filemanager",
  "version": "0",
  "id": "01929850-275f-7511-9fe2-3825cd786a76",
  "account": "123456789012",
  "time": "2024-10-17T02:30:42.783745070Z",
  "region": "ap-southeast-2",
  "resources": [],
  "detail": {
    "expiration": 30,
    "object-size-greater-than": 1024,
    "keep-on-move": true
  }
}
